{
  "schema_version": 1,
  "command_plane": "DEVICE_MANAGEMENT",
  "request_id": "8f14e45f-ceea-467a-9e3e-8f14e45fceea",
  "device_id": "module-07",
  "system_id": "system-a",
  "active_epoch": null,
  "pending_epoch": null,
  "last_provisioning_sequence": 0,
  "last_delegation_sequence": 0,
  "provisioning_key_fingerprint": "aaaaaaaaaaaaaaaaaaaaaaaaaaaaaaaaaaaaaaaaaaaaaaaaaaaaaaaaaaaaaaaa",
  "result": "AUTHORITY_UNPROVISIONED",
  "state": "UNPROVISIONED"
}
