{
  "schema_version": 1,
  "command_plane": "DEVICE_MANAGEMENT",
  "request_id": "8f14e45f-ceea-467a-9e3e-8f14e45fceea",
  "device_id": "module-07",
  "system_id": "system-a",
  "active_epoch": "22222222-2222-4222-8222-222222222222",
  "pending_epoch": "55555555-5555-4555-8555-555555555555",
  "last_provisioning_sequence": 20,
  "last_delegation_sequence": 1,
  "provisioning_key_fingerprint": "aaaaaaaaaaaaaaaaaaaaaaaaaaaaaaaaaaaaaaaaaaaaaaaaaaaaaaaaaaaaaaaa",
  "result": "PREPARED",
  "state": "PREPARED",
  "rotation_id": "44444444-4444-4444-8444-444444444444"
}
