{
  "schema_version": 1,
  "command_plane": "DEVICE_MANAGEMENT",
  "request_id": "8f14e45f-ceea-467a-9e3e-8f14e45fceea",
  "device_id": "module-07",
  "system_id": "system-a",
  "active_epoch": "22222222-2222-4222-8222-222222222222",
  "pending_epoch": null,
  "last_provisioning_sequence": 10,
  "last_delegation_sequence": 1,
  "provisioning_key_fingerprint": "aaaaaaaaaaaaaaaaaaaaaaaaaaaaaaaaaaaaaaaaaaaaaaaaaaaaaaaaaaaaaaaa",
  "result": "REJECTED",
  "state": "READY",
  "reason": "provisioning_sequence_rejected"
}
